{
  "schema_version": "1.0",
  "profile_id": "demo-user",
  "study_mode": "quiet",
  "preferences": {
    "quiet_priority": 0.9,
    "low_occupancy_priority": 0.8,
    "brightness_priority": 0.4,
    "comfort_priority": 0.5,
    "distance_priority": 0.3
  },
  "candidate_room_ids": [
    "room_a",
    "room_b",
    "room_c"
  ]
}
